{
  "judge_id": "c4-working-asset-05",
  "assumptions": [
    "The frozen business is a statutory Polish WEEE recovery organization, not a software vendor, broker, referral layer, or subcontractor to an incumbent organization.",
    "The cited ownership and 5 million PLN fully paid non-debt capital requirements apply before this organization can operate as proposed.",
    "The founder has no undisclosed coalition of eligible producers committed to provide the required capital and preserve meaningful founder economics.",
    "The founder must be able to retain meaningful lawful economic participation for the opportunity to satisfy the stated founder-net-worth objective."
  ],
  "factors": [
    {
      "name": "Core insight",
      "status": "scored",
      "score": 4,
      "rationale": "Producer responsibility creates recurring compliance work, and serial-level material-flow records could improve traceability. The demand is already understood and served, while the chosen statutory vehicle introduces constraints that overwhelm the proposed bootstrap premise."
    },
    {
      "name": "Customer pain and willingness to pay",
      "status": "scored",
      "score": 6,
      "rationale": "Importers and producers face mandatory registration, reporting, financing, collection, and treatment duties, so the underlying pain and recurring spend are real rather than discretionary. Willingness to pay a new entrant's proposed fees or switch from a trusted incumbent remains unvalidated."
    },
    {
      "name": "Business model and economics",
      "status": "scored",
      "score": 1,
      "rationale": "The 5 million PLN cash capital floor precedes launch, cannot be debt-funded, and is far beyond the founder's 100000-200000 PLN resources. Pricing is unvalidated and no credible margin or payback exists before treatment, collection, reserve, education, audit, insurance, and product-fee liabilities are quantified."
    },
    {
      "name": "Market and beachhead",
      "status": "scored",
      "score": 4,
      "rationale": "Small PV importers form a specific payer group and Poland's large installed PV base implies eventual end-of-life volume. Most installations are recent, return timing and mass are unestablished, and the beachhead is already served by national organizations."
    },
    {
      "name": "Competitive position and domination potential",
      "status": "scored",
      "score": 2,
      "rationale": "ElektroEko, ELECTRO-SYSTEM, and TOM already provide the full duty-transfer, reporting, collection, and treatment bundle with operating networks and compliance credibility. The packet identifies no exclusive supply, superior economics, switching wedge, or legal privilege for the entrant."
    },
    {
      "name": "Expansion potential",
      "status": "scored",
      "score": 4,
      "rationale": "A functioning compliance and material-flow platform could extend across equipment categories, services, and recycling transactions. Those adjacencies become relevant only after satisfying the same capital-intensive statutory obligations and displacing established multi-category providers."
    },
    {
      "name": "Defensibility and durability",
      "status": "scored",
      "score": 3,
      "rationale": "Statutory contracts, compliance systems, and treatment networks can create durable relationships once scaled. Here those barriers primarily protect incumbents; a serial ledger alone does not overcome their contracted producer base or operating network."
    },
    {
      "name": "Strength of advantage",
      "status": "scored",
      "score": 2,
      "rationale": "No evidence shows that serial-level tracking delivers a sufficiently lower fee, lower risk, better recovery result, or easier workflow than incumbent bundled services. The proposed pricing cannot itself constitute an advantage until liabilities and service coverage are costed."
    },
    {
      "name": "Timing and momentum",
      "status": "scored",
      "score": 3,
      "rationale": "The Polish PV base is large and producer responsibility is durable, but most panels will not return for many years and established recovery organizations already occupy the present compliance market. Near-term waste-flow momentum is therefore weaker than installation counts imply."
    },
    {
      "name": "Distribution",
      "status": "scored",
      "score": 2,
      "rationale": "Customs, accounting, wholesale, and renewable-sector referrals are plausible lead sources. Launch nevertheless requires high-touch recruitment of eligible producer-shareholders as well as importer contracts, while incumbents already bundle national execution and trust."
    },
    {
      "name": "Execution and risks",
      "status": "scored",
      "score": 1,
      "rationale": "The legal form, restricted ownership, 5 million PLN non-debt capitalization, environmental management, audits, recycler network, liability exposure, and producer sales cannot be assembled as a founder-owned part-time bootstrap within the stated resources. This is direct structural incompatibility, not merely absent validation."
    }
  ],
  "interaction_adjustment": -0.4,
  "main_structural_strength": "Mandatory recurring producer obligations create durable underlying demand, and a compliant contract plus material-flow ledger could become a high-switching-cost operating control point once established.",
  "primary_score_limiter": "The statutory entity requires 5 million PLN paid in non-debt cash and restricted producer-side ownership before launch, making the frozen founder-owned opportunity incompatible with available capital and part-time execution.",
  "strongest_disconfirming_evidence": "Polish law directly requires at least 5 million PLN fully paid in cash before registration, prohibits debt funding of that capital, and restricts ownership to specified producer-side entities; this invalidates the proposed bootstrap and founder-equity path.",
  "evidence_needed_for_higher_score": "Binding commitments from eligible producer-shareholders to fund the full statutory capital while providing the founder a lawful and economically meaningful participation, plus incumbent-comparable treatment quotes, liability coverage, and importer contracts demonstrating positive unit economics.",
  "highest_value_structural_change": "Abandon ownership of the statutory recovery organization and sell a serial-level BDO compliance and reconciliation platform through established recovery organizations, preserving a scalable data product while letting licensed incumbents hold the regulated contracts, capital, and treatment liabilities."
}
